Question,Right Answer,Option 1,Option 2,Option 3,Lowest Level Topic,Description
"In general, NEC meeting should be held",4 times a year,2 times a year,3 times a year,6 times a year,Engineering Professional Practice,
"Engineers shall act in such a manner as to uphold and enhance the honor, and dignity of engineering profession and shall act with......... for bribery, fraud and corruption",zero tolerance,tolerance,penchant,predilection,Engineering Professional Practice,
Code of conduct defines,what should be,what should not be,what had been,what will be,Engineering Professional Practice,
Time period member of NEC body is,4 years,5 years,7 years,8years,Engineering Professional Practice,
The number of corrugations in galvanized iron sheet is usually,10,12,8,6,"Estimation, Costing and Valuation",
The density if cement is generally taken as,1440kg/m^3,1550kg/m^3,1600kg/m^3,1750kg/m^3,"Estimation, Costing and Valuation",
"In rate analysis, the number of bricks per cubic metre is taken as",500,5000,2000,250,"Estimation, Costing and Valuation",
"In long wall and short wall method, length of long wall is the centre to centre distance between the walls and",half the breadth of wall on each side,breadth of wall,one fourth breadth of wall on each side,none of the above,"Estimation, Costing and Valuation",
Original cost of property minus depreciation is,Book Value,Salvage Value,Scrap Value,rebelable value,"Estimation, Costing and Valuation",
The minimum width of septic tank is taken as,75 cm,90 cm,80 cm,70 cm,"Estimation, Costing and Valuation",
Specification of hold fasts are provided in terms of,number,volume,weight,length,"Estimation, Costing and Valuation",
A bill of quantity consists of,All of the given,description of item,quantity of item,item rate,"Estimation, Costing and Valuation",
The most reliable estimate is,detailed estimate,preliminary estimate,plinth area estimate,cubic rate estimate,"Estimation, Costing and Valuation",
The volume of cement in one 50kg bag in cubic metres is,0.034,0.04,0.05,0.025,"Estimation, Costing and Valuation",
Which of the following is the most correct estimate,Item rate estimate,building cost index estimate ,plinth area estimate,cubic rate estimate,"Estimation, Costing and Valuation",
"When an object is cut by a section plane parallel to horizontal plane and perpendicular to vertical plane, the sectional view of the object is obtained in",Top view,Bottom view,Right side view,Left Side View,"Estimation, Costing and Valuation",
"In detailed estimate, the volumes are worked out to nearest",0.01 m³,0.001 m³,0.02 m³,0.05 m³,"Estimation, Costing and Valuation",
Rate analysis consists of,All of the above,material,labour,contractor's profit,"Estimation, Costing and Valuation",
The volume of coarse aggregate required to make 1000 m³ of 1 : 2 :4 concrete is,84m³,98m³,79m³,72m³,"Estimation, Costing and Valuation",
"In specification of earthwork in foundation trenches, drains etc, lift is specified as",1.5m,3m,5m,30m,"Estimation, Costing and Valuation",
The useful part of livable area of building is,carpet area,plinth area,circulating area,living area,"Estimation, Costing and Valuation",
The reduction in wet volume compared to dry volume in Mortar is taken as,25-30%,30-35%,35-40%,50-55%,"Estimation, Costing and Valuation",
The reduction in wet volume compared to dry volume in Concrete is taken as,50-55%,25-30%,30-35%,20-25%,"Estimation, Costing and Valuation",
The overhead and profit (15%) claimed by contractor is,included in rate analysis,included in material,included in labour,in a separate item,"Estimation, Costing and Valuation",
Number of unknowns to be determined in the stiffness method is equal to,kinematic indeterminacy,Static indeterminacy,sum of static and kinematic indeterminacy,nonw of the above,Indeterminate Structures,
A hydrometer is used to measure,Specific gravity of liquids,Flow of fluids,Velocity of fluids,Velocity of gases,Index Properties of Soil,
The maximum size of clay particle is,0.002mm,0.03,0.1,0.002,Index Properties of Soil,
The maximum size of silt particle is,0.06,0.02,0.2,0.5,Index Properties of Soil,
A well graded sand should have,All of the given,Uniformity coefficient greater than 4,Coefficient of curvature between 1 and 3,Effective size greater than 1mm,Index Properties of Soil,
The shape of particle size curve is represented by,Coefficient of curvature,Effective size,Effective diameter,Unifom coefficient,Index Properties of Soil,
A particle-size distribution curve gives us an idea about,Type of soil,Properties of soil,Consistency of soil,Liquid limit,Index Properties of Soil,
The property of soil by virtue of which it can be deformned rapidly without rupture is,Plasticity,Elasticity,Tenacy,Hardness,Index Properties of Soil,
"The ratio of liquid limit,minus the natural water content to the plasticity index of the soil is",Consistency Index,Plasticity Index,Liquidity index,Shrinkage index,Index Properties of Soil,
Clay doesn't become plastic when it is mixed with,Kerosene,Oil,Soap Solution,Water,Index Properties of Soil,Kerosene is a non polarizing liquid
"In consistency of soil, the limits are expressed in terms of",Percentage water content,Area,Volume,weight,Index Properties of Soil,
The grooving tool used to find liquid limit is,ASTM tool,Groove tool,Split spoon sampler,All of the above,Index Properties of Soil,
The depth of groove cut by cassagrande tool for determining the liquid limit is,11mm,10mm,2mm,8mm,Index Properties of Soil,
What is the diameter of the seive used for finding the liquid limit?,425microns,75 microns,275 microns,200 microns,Index Properties of Soil,
The toughness index is defined as the ratio of,Plasticity index/flow index,Plastic limit/lliquid limit,Liquid limit/flow index,Plastic limit/ flow limit,Index Properties of Soil,
The shear strength of the soil at liquid limit is,17.6 g/cm^2,17.6 KN/m^2,1.89Kn/m^2,18.9g/cm^2,Index Properties of Soil,
The density of mercury used in shrinkage limit apparatus is,13.6g/cm^3,13.0g/cm^3,12.6g/cm^3,14.6g/cm^3,Index Properties of Soil,
The field density of natural soil deposit cannot be determined by,Oven drying method,Sand replacement method,Core cutter method,Water displacement Method,Index Properties of Soil,
Sensitivity of most clays usually falls in a range of,1 to 8 ,2 to 8,2 to 6,1 to 5,Index Properties of Soil,
Laboratory classification of fine grained soil is done with the help of,Plasticity chart,Textural Classification chart,Kozney's graphical method,None of above,Index Properties of Soil,
The equation of A-line is given by,Ip=0.73(Wl-20),Ip=0.68(Wl-20),Ip=0.57(Wl-20),Ip=20-Wl,Index Properties of Soil,
What is the principle of surveying?,Working from Whole to Part,Working from part to whole,Location of a point by measuring from one station,Both A and C,Introduction and types,
"What is the benefit of following ""Working from whole to part""?",Prevent the accumulation of error,Distribute the error,Make the measurement easier,None of above,Introduction and types,
The curvature of the earth is taken into account when the extent of survey is more than?,260 sq km,140 sq km,60 sqkm,640 sq km,Introduction and types,Actual area is 195.5 sq.km
Hydrographic survey deals with?,Survey of large water bodies,Survey around the river,Canal system,Mountainous regions,Introduction and types,
The branch of surveying which deals with the measurement in vertical plane is known as,Levelling,Plane tabelling,Centering,Triangulation,Introduction and types,
The survey in which curvature of the earth is taken into account is called,Geodetic Survey,Plane Survey,Hydrographic Survey,Earth survey,Introduction and types,
The difference between the arc and subtended chord on a earth surface for a distance of 18.5km is,1cm,1mm,10cm,15cm,Introduction and types,
The differences between sum of angles of spherical triangle and a plane triangle is,1'',1',"1.5""","2""",Introduction and types,
The differences between sum of angles of spherical triangle and a plane triangle is also known as,Spherical Access,Great angle,Plane access,None of above,Introduction and types,It is the value by which the sum of angles in a triangle exceeds 180 degrees
"The survey used to fix the property line of personal, municipalities, state, etc is known as",Cadastral Survey,Topographical survey,Property Survey,City Survey,Introduction and types,
A fixed point of known elevation is known as,Benchmark,Datum,Reduced level,Station,Introduction and types,
"In surveying, the first step taken is",Reconnaissance,Running survey line,Drawing,marking stations,Introduction and types,
Survey is classified,based on all of above,based on curvature of earth,based on nature of field,based on instrument used,Introduction and types,
Walking over the areas and observing its main features and boundaries is known as,reconnaissance,inspection,observation,any of these,Introduction and types,
"Survey which are carried out to depict mountain,rivers,water bodies,wooded areas and other cultural details are known as",topographical surveys,cadastral surveys,plane surveys,hydrographical surveys,Introduction and types,
What does the surface of water of still lake represent?,Level Surface,Contour line,contour gradient,horizontal surface,Levelling,
What does the boundary of water of still lake represent?,Contour line,horizontal equivalent,Horizontal surface,Level Surface,Levelling,
"In leveliing, a station is a point where",Staff is placed,instrument is placed,benchmark,datum,Levelling,
Levelling across a river is done by,Reciprocal levelling,fly levelling,barometric levelling,cross levelling,Levelling,
A line normal to plumb line at all points is known as,level line,horizontal line,vertical line,line of sight,Levelling,
An arbitrary surface with respect to which the elevation of points are measured is called,Datum Surface,Bench mark,Horizontal surface,Level Surface,Levelling,
The method of surveying used for determining relative position of points on the surface of the earth is called,levelling,simple levelling,differential levelling,longitudinal levelling,Levelling,
The vertical distance above or below the datum is called,elevation of point,height of instrument,rise,none of above,Levelling,
A fixed point of reference of known elevation is called,benchmark,datum,change point,station point,Levelling,
A staff reading taken on a bench mark is called,back sight,foresight,intermediate sight ,all of the above,Levelling,
"When staff reading is taken, the line of collimation shoild be",horizontal,vertical ,inclined,any of these,Levelling,
The plane of collimation head compared to the height of instrument is,equal,more,less,"may be more,less or equal",Levelling,
The height of instrument is equal to,RL of BM+B.S.,RL of BM+F.S.,RL of B.M-B.S.,all of the above,Levelling,
The collimation method for obtaining RL of points does not provide,Intermediate sight,Foresight,Back Sight,Change point,Levelling,
Height of instrument method is used for,Profile levelling,Check Levelling,differential levelling,Reciprocal Levelling,Levelling,"used in construction work like road, bridge etc"
Accuracy of rise and fall method as compared to height of instrument method is,equal,less,more,none of above,Levelling,
Rise and fall method provides check in,all of above,Foresight,Back Sight,Intermediate Sight,Levelling,
An imaginary line tangential to the longitudinal curve of bubble tube at its middle point is called,axis of level tube,line of sight,axis of telescope,line of collimation,Levelling,
A curved surface which is normal to the direction of gravity at all point is known as,Level Surface,level line,horizontal surface,datum surface,Levelling,
A line normal to level surface at a point is called,vertical line,level line,horizontal line,line of sight,Levelling,
A staff reading taken on a point whose elecation is to be determined on a change point is,foresight,backsight,intermediate sight ,line of sight,Levelling,
A straight line tangential to the level line at a point is called,horizontal line,horizontal plane,level line,vertical line,Levelling,
Benchmark is established by,Spirit levelling,Trigonometric levelling,Barometric levelling,Reciprocal Levelling,Levelling,
The least count of levelling staff is,5mm,1cm,5cm,1mm,Levelling,
Levelling in which the elevation of points along a given line is known as,profile levelling,fly levelling,cross section levelling,reciprocal Levelling,Levelling,
The reading on the turning point is,Foresight and Backsight both,Foresight,Back Sight,Intermediate Sight,Levelling,
Check for collimation method is,Sum of BS-Sum of FS,First RL-Last RL,Rise-Fall,all of the above,Levelling,Sum of BS-Sum of FS= Last RL-First RL
The difference between level line and horizontal line is,Level line is curved but horizontal line is straight,Level line is straight but horizontal line is curved,Both are same,none of above,Levelling,
The first observation taken on turning point is,foresight,backsight,Intermediate sight ,Both foresight and back sight,Levelling,
The last staff reading from any levelling station is,foresight,backsight,Intermediate sight ,Fore Bearing,Levelling,
"When adjusting a levelling instrument, if telescope cannot be moved independently, the instrument is called",Dumpy level,Y level,Tilting level,Reversible level,Levelling,
Levelling deals with measurement in ,Vertical plane,Horizontal plane,Inclined plane,both horizontal and vertical plane,Levelling,
Height of any point with respect to mean sea level is called,Reduced level,height of instrument,Change point,station point,Levelling,
The surface of 0 elevation around the earth which is slightly irregular and curved is called,mean sea level,level surface,horizontal surface,vertical surface,Levelling,
In levellng operation,the line start with backsight and closes with foresight,the line starts with foresight and ends with backsight,the first sight on any change point is backsight,the second sight on any change point is foresight,Levelling,
The method of levelling used to carry out reconnaissance of area is,fly levelling,Check Levelling,Simple levelling,reciprocal Levelling,Levelling,
Which of the following levelling is done to determine elevation difference between two points on surface of the earth,differential,reciprocal,simple levelling,profile ,Levelling,
Telescope of dumpy level ,is rigidly fixed to levelling head,can be tilted by 4 degrees in a vertical plane,can be taken out of its support and reversed,a compensation is fitted that levels automatically,Levelling,
Which of the following is used to determine the difference of elevation of two points that are quite apart,Reciprocal levelling,simple levelling,profile levelling,fly levelling,Levelling,
"For true difference in elevation between two points A and B, level must be set up",at the exact mid point of A and B,at any point between A and B,Near A,Near B,Levelling,
Which test is used to make horizontal axis perpendicular to vertical axis,Spire Test,Azimuth Test,Cross hair ring test,plate level test,Levelling,
Reciprocal Error eliminates,"Collimation, curvature and refraction error",collimation error,curvature and refraction,curvature error fully and refraction error partly,Levelling,Can't eliminate parallax error
"If the BM of station A is 250m, the BS reading at the point is 2m and FS reading of station B is 2.5m, the RL of station B is",249.5m,252m,252.5m,254.5m,Levelling,
"During levelling, ",Both,"When the instrument is being shifted, the staff must not move","when the staff is being shifted, the instrument must not move",none of the given,Levelling,
Removal of parallax may be done by,focussing objective and eyepiece,focussing objective,focussing eyepiece,none of the above,Levelling,
Number of subdivisions per metre length of a levelling staff is,200,100,500,1000,Levelling,
Pick up the wrong statement,the diaphragm is placed between the eyepiece and objective closer to the later,the diaphragm is placed between the eyepiece and objective closer to the former,the outer component of the objective is a double convex lens of crown glass,the inner component of the objective is a flint glass,Levelling,
"The ratio of the distances at which a stated length can be distinguished by the telescope and the human eye, respectively, is called",Resolving power of telescope,brightness of telescope,magnification of telescope,none of these,Levelling,
The process of adding water to lime to convert it in hydrated lime is,slaking,hydration,watering,calcination,lime,
The property by virtue of which lime sets under water is,hydraulicity,slacking,setting,hardening,lime,
The first moment of area about the reference axis is,Centroid,Moment of Inertia,modulus of section,None of above,Moment of Inertia,
The theorem of parallel axis is used to determine MI about an axis___ to centroidal axis,parallel,perpendicular,coinciding,None of above,Moment of Inertia,
The area moment of inertia is measure of resistance to,Bending,twisting,compression,bending,Moment of Inertia,
The second moment of area about the reference axis is,Moment of Inertia,Centroild,Modulus of section,None of above,Moment of Inertia,
The theorem of perpendicular axis is used to determine MI about an axis___ to centroidal axis,Polar,horizontal,Vertical,None of above,Moment of Inertia,
The polar moment of inertia is measure of resistance to,twisting,bending,compression,tension,Moment of Inertia,
The MI of a rectangle of width b and depth d about horizontal centroidal axis is,bd^3/12,db^3/12,bd^3/36,db^3/36,Moment of Inertia,
The MI of a square lamina of side A about the diagonal is,A^4/12,A^4/3,A^4/6,A^4/4,Moment of Inertia,
The MI of a plane lamina is 2*10^6 mm^4. If its area is 40000 sqmm then its radius of gyration is,7.07,10mm,50mm,20mm,Moment of Inertia,
Which of the following cross section have equal moment of inertia about ani axis passing through its centroild?,Circle,Rectangle,Triangle,Square,Moment of Inertia,
The ratio of moment of Inertia of a circular plate to square plate for equal depth is,equal to 3π/16,equal to 1,equal ,equal to 3,Moment of Inertia,
The section modulus of a rectangular section is proportional to,Area of section,Square of the area of section,product of the area and depth,product of area and width,Moment of Inertia,
The algebraic sum of the vertical forces on either side of section of a loaded beam is known as,Shear force,bendimg moment,deformed force,all of the above,Moment of Inertia,
Which of the following is used as a carrier in paint?,Linseed oil,Almond Oil,Olive oil,Sunflower oil,Paints,Vehicle/carrier/binder
The ingredient of paint used to hide the surface irregularities and imparts color is known as,Pigments,Adultrants,Drier,Solvents,Paints,
The commonly used thinner in oil paints is,Both,Naphtha,Turpentine,None of the above,Paints,Also called solvent
The base material for distemper is,Chalk,Lime,Clay,Lime putty,Paints,Chalk+Water
"In paints,methylated spirit,naptha and turpentine are used as",Solvent,Base,Binder,Extender,Paints,
The most durable varnish is,Oil Varnish,Water varnish,Spirit varnish,Turpentine varnish,Paints,
Zinc oxide is a pigment having,White colour,Blue Colour,Black colour,Yellow colour,Paints,
The paints that are most resistant to fire are,Asbestos cement,Enamel paints,Aluminium paints,Cement paints,Paints,
Distemper is used on,Plastered surface not exposed to weather,Plastered surface exposed to weather,Roof tops,Unplastered brick wall,Paints,
The detachment of the paint film from the surface is known as,Flaking,cracking,chalking,wrinkling,Paints,
"For prestressed concrete, high strength concrete is used primarily because ",modulus of elasticity is high and creep is low,modulus of elasticity is high and creep is high,both shrinkage and creep are more,shrinkage is less but creep is more,Pre-stressed concrete,
Which Scale is used to measure upto three dimensions?,Diagonal Scale,Plane Scale,Scale of Chords,Triangular Scale,Scale and Map,
The vernier in which the graduation of vernier scale increase in the same direction as that of main scale is,Direct Vernier,Retrograde Vernier,Regular Vernier,Irregular Vernier,Scale and Map,
The vernier in which the graduation of vernier scale increase in the opposite direction as that of main scale is,Retrograde Vernier,Straight vernier,Direct Vernier,Inverted Vernier,Scale and Map,
"If n number of divisions of vernier scale coincide with n-1 divisions of main scale, it is called",Direct Vernier,Retrograde Vernier,Regular Vernier,Irregular Vernier,Scale and Map,
"If n number of divisions of vernier scale coincide with n+1 divisions of main scale, it is called",Retrograde Vernier,Regular Vernier,Direct Vernier,Inverted Vernier,Scale and Map,
"If n number of divisions of vernier scale coincide with 2n-1 divisions of main scale, it is called",Extended Vernier,Direct Vernier,Retrograde Vernier,Straight Vernier,Scale and Map,
Calculate number of divisions of main scale that equals 10 division of extended vernier,19,15,21,25,Scale and Map,
Distance between two brass rings in a surveyor's chain is,20cm,20m,30cm,30m,Scale and Map,
The scale 1cm=500m equals,1 : 50000,1 : 500,1 : 500000,1 :50,Scale and Map,
Which of the followin statement in regard to map A having scale 1:2000 and another map B having scale 1: 6000 is true?,Map A is large Scale map compared to Map B,Map B is large scale map compared to map A,Map B is more detailed than map A,None of these,Scale and Map,
The instrument used to set off angles is,Scale Of Chords,Direct Scale,Retrograde Vernier,Angular Scale,Scale and Map,
"Calculate the number of divisions of main scale required to construct a direct vernier for a theodolite circle divided into degrees  and one third degree to read upto 20""",59,60,61,20,Scale and Map,
"Calculate the number of divisions of vernier scale required to construct a direct vernier for a theodolite circle divided into degrees  and one third degree to read upto 20""",61,59,60,20,Scale and Map,
Which of the following Scale is the smallest one,1 : 2000000,1 : 200000,1 : 20000,1 : 2000,Scale and Map,
Which of the following Scale is the smallest one,1cm=5000m,4 : 200000,1cm=50m,RF=1/50000,Scale and Map,
Topographic maps are used to represent,natural detail,construction detail,structural detail,all of the above,Scale and Map,
"If a rectangular shaped land of actual size 30m x 50m is drawn on a drawing by a rectangular size 15mm x 25mm, the representative factor is",1 : 2000,1 : 200,1:20,1 :2500,Scale and Map,
Soil can exist in how many states?,4,3,2,1,Soil properties,"Liquid,plastic,semi solid and solid"
"In oven drying method for determination of water content, temperature maintained is:",105-110 degrees,100-105 degrees,110-120 degrees,140-150 degrees,Soil properties,
A soil generally consists of combination of __________ separates.,3,2,4,1,Soil properties,"Clay, Silt and Sand"
Loose soil has a relative density within a range of:,10-35,35-54,85-100,60-80,Soil properties,
Liquid limit of soil is tested using_____apparatus?,Cassagrande,Mohr,Otto,Terzaghi,Soil properties,
The modulus of elasticity of mild steel is equal to,210kN/mm^2,10KN/m^2,10KN/mm^2,210kN/m^2,Steel,
The process of taking out stone from natural rock is known as,Quarrying,Cladding,Weathering,Dressing,Stone,
Which of the following is sedimentary rock,Sandstone,Granite,Marble,quartzite,Stone,
Which of the following is chemical classification of rock,Siliceous rock,Stratification Rock,Foliated rock,intrusive rock,Stone,
"An explosive containing 65% saltpeter,20% sulphur and 15% charcoal is",Blasting Powder,Dynamite,Nitrocellulose,Cordite,Stone,
Which of the following is unstratified rock?,Marble,Limestone,Slate,Sandstone,Stone,"Igneour Rocks, Marble, Trap etc."
"Chemically,marble is known as",Calcareous Rock,Metamorphic Rock,Silicious Rock,Argillaceous Rock,Stone,
Plaster of paris is obtained by calcination of,Gypsum,Bauxite,Kankar,Limestone,Stone,
Alumina is obtained from,Bauxite,Gypsum,Kankar,Limestone,Stone,
Stone is rejected if it absorbs water more than,10%,5%,20%,25%,Stone,
Good building stone absorbs water less than,5%,10%,20%,25%,Stone,
Which of the following is a rock?,Gypsum,Quartz,Mica,None of the above,Stone,
Rocks having alumina or clay as their major constituent are called,Argillaceous Rocks,Siliceous Rock,Sedimentary Rock,Metamorphic Rock,Stone,
Sandstone is,Sedimentary Rock,Metamorphic Rock,Igneous Rock,Volcanic Rock,Stone,
Crushing strength of good building stone should be more than,1000kg/cm^2,500kg/cm^2,1400kg/cm^2,2000kg/cm^2,Stone,
Hardness of rock can be tested insitu using,Schmidth Hammer test,Smith's test,Acid test,Crystallization test,Stone,
Soluble matters in Stone is tested using,Smith's test,Schmidth Hammer test,Acid test,Crystallization test,Stone,
Durability of a stone is tested using,Crystallization test,Smith's test,Acid test,Schmidth Hammer test,Stone,
The most suitable stone for building piers is,Granite,Limestone,Marble,Sandstone,Stone,
Basalt  stone is by nature,Volcanic Rock,Metamorphic Rock,Sedimentary Rock,Plutonic Rock,Stone,Extrusive Igneous Volcanic Rock
Granite is,Plutonic Rock,Metamorphic Rock,Sedimentary Rock,Volcanic Rock,Stone,
"Under heat and pressure, granite can transform into",Gneiss,Quartzite,Marble,Slate,Stone,
Quartzite and marble are by nature,Metamorphic,Volcanic,Plutonic,Sedimentary,Stone,
The natural bedding plane of stones and the direction of pressure in stone masonry is,Normal,Parallel,At 30 degrees,At 45 degrees,Stone,
The process of providing smooth and regular face to stone is known as,Dressing,Quarrying,Seasoning,Pitching,Stone,
Interlocking of stones is known as,Pitching,Quarrying,Seasoning,Dressing,Stone,
Following stone is suitable for damp proofing,Slate,Marble,Laterite,Granite,Stone,Slate is assumed as non absorbent
Gneiss is used in,Street Paving,Damp proofing,Fire resistance,Water resistance,Stone,
Stonewalls are constructed using,Sand Stone,Limestone,Granite,Gneiss,Stone,
