Question,Right Answer,Option 1,Option 2,Option 3,Lowest Level Topic,Description
The modular ratio due to the effect of creeping in concrete,Increases,Decreases,Remains constant,Either increases or decreases,Concrete Technology,
The unit of RCC is,2500 Kg/m2,2000kg/m2,3500kg/m2,3000kg/m2,Concrete Technology,
The approximate value of the total shrinkage strain may be taken as,0.0003,0.0002,0.003,0.002,Concrete Technology,
The workability of concrete us influenced most by its,Water-cement ratio,Aggregate cement ratio,Cement content,Water content,Concrete Technology,
The workability of concrete for a given water content is good if aggregates are,Rounded aggregate,Irregular Aggregate,Angular Aggregate,Flaky Aggregate,Concrete Technology,
The compaction of concrete improves,All of the given,Density,Strength,Durability,Concrete Technology,
"For preparing a test specimen, it is necessary",All of the given,To mix the cement and fine aggregate by dry hand,To mix coarse aggregate,To mix water to the cement fine aggregates and coarse aggregates,Concrete Technology,
Workability of concrete mix with low water cement ratio is determined by,Compaction factor test,Tensile strength test,Slump Test,Flexure Strength Test,Concrete Technology,
The showing up of white fluffy layers on the surface of concrete is known as,Efflorescence,Consistency,Segregation,None of the given,Concrete Technology,
"For proper workability of concrete, the water cement ratio varies from",0.4 to 0.6,0.1 to 0.2,0.2 to 0.3,0.3 to 0.4,Concrete Technology,
Separation of coarse aggregate from moratar during transportation is known as,Segregation,Bleeding,Creeping,Shrinkage,Concrete Technology,
Water cement ratio is,Weight of water to that of cement,Volume of water to that of cement,Both volume of water to that of cement and weight of water to that of cement,Weight of concrete to that of water,Concrete Technology,
Higher workability of a concrete is required if a structure is,Thick and heavily reinforced,Thin and heavily reinforced,Thick and lightly reinforced,Thin and lightly reinforced,Concrete Technology,
What is the bottom diameter(mm) of the standard mould used in slump test of the concrete?,200,100,300,150,Concrete Technology,
"If the size of specimen used to test the compressive strength of concrete is decreased, then compressive strength of concrete will",Increases,Decreases,First increases then Decreases,Is not affected by the size,Concrete Technology,
The common admixture used to accelerate the initial setting time of concrete is,Calcium Chloride,Gypsym,Bitumen,Mixture of Bitumen and inert material,Concrete Technology,
"The process of mixing, transporting, placing and compacting concrete using ordinary portland cement should not take more time than",30 minutes,40 minutes,75 minutes,90 minutes,Concrete Technology,
The age of concrete with age,Increases,Decreases,Unaffected,"Increases, then decreases",Concrete Technology,
Bleeding is good to an extent if it occurs when the concrete is ,Plastic,Transported ,Mixed,Placed,Concrete Technology,
The size of concrete specimen used for compression test is,150*150*150mm,50*50*50mm,100*100*100mm,150*50*75mm,Concrete Technology,
What are used to press the mortar and spread uniformly,Floats,Aluminium rod,Brush,Trowel,Concrete Technology,"Screeding, Floating, Troweling"
M20 is,1 : 1.5 : 3,1 : 1: 2,1 : 2 : 4,1 : 3:6,Concrete Technology,
Steam Curing is adopted for,Precast structure,Columns,Beams,Thin Structures,Concrete Technology,
The result of Vee-Bee test is expressed in terms of,S,m,N/mm2,kg,Concrete Technology,
Which of the following statement is true?,All of the given,The quality of water governs the strength of concrete,The quality of water required for concreting depends on the grading of aggregate and method of compaction,10% excess water reduces the strength of concrete by 15%,Concrete Technology,
The process of accurate measurement of concrete ingredients for uniformity in proportion is known as,Batching,Grading ,Curing,Mixing,Concrete Technology,
How many components are basically used to make concrete,4,5,3,2,Concrete Technology,
Retarders are used for,Grouting deep oil wells,Cold Weather condition,Construction of high rise building,Repair Works,Concrete Technology,
Excess Vibration in concrete leads to,Segregation,Bleeding,High Strength,Air Bubbles,Concrete Technology,
"If the slump of concrete mix is 60mmm, its workability is",Medium,Very Low,Low,High,Concrete Technology,
"To obtain a very high strength concrete, use very fine grained",Granite,Volcanic Scoria,Magnetite,Barite,Concrete Technology,
Tensile strength of concrete is found out using,Split tensile test,Gradual tensile test,Radial tensile Test,None,Concrete Technology,
Compaction of concrete helps to,Remove air bubbles,Place concrete on sloping surface,Add air bubbles,Remove water,Concrete Technology,
The final operation of finishing floors is known as,Trowelling,Floating,Screeding,Finishing,Concrete Technology,
The compacting factor of 0.95 represents that the workability of concrete is,High,Medium,Low,Very Low,Concrete Technology,
Compacting factor is,Weight of partially compacted concrete/Weight of fully compacted concrete,Weight if fully compacted concrete/ weight of partially compacted concrete,Both,None,Concrete Technology,
What is the approximate ratio of 7 days strength of concrete to 28 days strength,0.65,0.45,0.95,1.15,Concrete Technology,
What is the maximum height through which concrete can be poured,1.5m,1m,0.8m,0.5m,Concrete Technology,
Concrete attains major part of its strength in,1 week,2 week,3 week,4 week,Concrete Technology,
"For constant water cement ratio, decrease in aggregate cement ratio causes",Increase the workability,Decrease the workability,No Change,Either Increase or Decrease,Concrete Technology,
Characteristic Strength of concrete is measured in,28 days,14 days,7 days,45 days,Concrete Technology,
Ordinary concrete is not used for concrete grades,M 40,M25,M15,M10,Concrete Technology,
Shrinkage in concrete can be reduced by using,All of the above,Low water cement ratio,Less cement in the concrete,Proper concrete mix,Concrete Technology,
The operation of removing humps to form uniform surface of concrete is known as,Screeding,Floating,Trowelling,Finishing,Concrete Technology,
The initial setting time of fresh concrete is,Greater than 1 hour,Lower than 15 minutes,Greater than 30 minutes,Less than 30 minutes,Concrete Technology,30 minutes is for cement and 1 hour is for concrete
pH of water should lie between,6-9,5-8,7-14,3-6,Concrete Technology,
The permanent deformation of concrete with time under steady load is,Creep,Viscoelasticity,Viscosity,Relaxation,Concrete Technology,
Poisson's ratio of cement concrete is,0.1-0.2,0.2-0.25,0.2-0.23,0.25-0.3,Concrete Technology,
Too wet concrete may result in,Bleeding,Hardening,Higher Density,Compactness,Concrete Technology,
Concrete gains strength due to,Hydration of Cement,Reaction of cement and sand,Evaporation of water,All of the above,Concrete Technology,
The expansion joints are provided in concrete structure if the length exceeds,45m,20m,30m,75m,Concrete Technology,
Nominal mix may be used for concrete of,M25 or lower,M20 or lower,M25 or higher,M30 or higher,Concrete Technology,
The grade of M150 means that compressive strength of a 15cm cube after 28 days is,150kg/cm^2,100 kg/cm^2,200kg/cm^2,250kg/cm^2,Concrete Technology,
Workability of concrete in slump test is measured in,mm,m,mm/hr,hour,Concrete Technology,
The unit weight of plain cement concrete is taken as,24KN/m^3,25KN/m^3,19KN/m^3,17KN/m^3,Concrete Technology,
Bulking of sand is maximum when the moisture content is,4%,7%,10%,12%,Concrete Technology,
Slump test is done for,concrete,cement,sand,aggregate,concrete Technology,
The commonly used material in cement production is,limestone,sandstone,slate,granite,concrete Technology,
Curing period is minimum for concrete using,Rapid Hardening Cement,Ordinary Portland Cement,Low heat cement,Slag cement,concrete Technology,
"When water leaks out of the shutterring in which fresh concrete has been poured, the defect likely in cement concrete is",honeycombing,lattiance,no setting,seggregation,concrete Technology,
"If the slump of concrete mix is 80mm, then the workability concrete is said to be",High,medium,low ,very low,concrete Technology,
The maximum particle size of coarse aggregates in concrete mix should not be more than,40mm,55mm,65mm,75mm,concrete Technology,
Plain cement concrete is good for taking,compressive stress,tensile stress,both compressive and tensile stress,shear stress,concrete Technology,
The project manager has authority to approve variation upto,10%,7%,12%,15%,Construction Management,
"For procurement works upto 2 million, which method of procurement is considered?",by sealed quotation,by direct negotiation,by bidding,by direct labour or direct negotiation,Construction Management,
A contractor can start the construction works following the receipt of,notice to proceed,award of contract,variation order,contract agreement,Construction Management,
Quality assurance plan is prepared,before the construction works start,after the construction works complete,during construction work,none of the given,Construction Management,
The first method developed for planning project was,Bar Chart,Milestone Chart,CPM,PERT,Construction Management,
"In order to balance the needs of many stakeholder involved in project, the most desirable method to achieve resolution of conflickts would be",compromise,controlling,forcing,confrontation,Construction Management,
Security deposit deducted from the contractor's bill is,refunded when the defect liability period is over,refunded upon completion of work,refunded when good progress is achieved,retained till lifespan of project,Construction Management,
Critical Path moves along the particles having total float as ,zero,positive ,negative,unity,Construction Management,
Optimum project duration denotes,minimum overall cost,minimum direct cost,minimum indirect cost,all of the given,Construction Management,
The pretender stage of construction requires,all of the given,site selection,land acquisition,design finalization,Construction Management,
"Due to omission of any component, the total cost of project",decreases,increases,constant,can't be calculated,Construction Management,
Sensitivity Analysis is a study of,change in output due to change in input,economics of cost and benefit of project,comparison of profit and loss,comparison of assets and liabilities,Construction Management,
A construction schedule is prepared after collecting,all of the given,quantity of various items,number of operations,output,Construction Management,
The fixed sum to be paid by the contractor having no relationship with real damage is,liquidated damage,fixed penalty,compensatory payment,fine charge,Construction Management,
The process of studying the result/output of project is known as,Evaluation,Indicator,Checking,Monitoring,Construction Management,
Small jobs assigned to individual or firms; not directly employed on the project are known as,sub-contracts,job work,ancillary works,miscellaneous works,Construction Management,
A bar chart is drawn for,time versus activity,activity versus resources,resources versus progress,progress versus time,Construction Management,
A variation order is issued to a contractor by tge authorized personnel of the client when,All of the given,it becomes necessary to change the design and drawing,the quantity of items given in the contract document is to be changed,new items of work are to be added,Construction Management,
Milestones are,beginning of various activities,activities,vertical bar chart,supervision of work,Construction Management,
Which of the following is not a bid document?,letter of acceptance,condition of contract,specification,performance security form,Construction Management,
Which of the following is not a reason for establishing good occupational health and safety standard?,religious,economic,moral,legal,Construction Management,
The purpose of BId evaluation id to determine,Lowest evaluated substantially responsive bid,lowest bid,responsive bid,any of the above,Construction Management,
The chart that gives an estimate about the amount of materials handling between various work stations is known as,travel chart,process chart,flow chart,operation chart,Construction Management,
Pre-qualification criteria is approved by,concerned department chief,project engineer,secretary,minister,Construction Management,
The time between ordering of goods and materials and placing them into use at the time of need is called,lead time,delayed time,order time,use interval,Construction Management,
All measurement should be recorded in a,measurement book,note book,daily book,muster roll,Construction Management,
Acquisition of any land for any construction should be performed,before tender,durinf tender,after tender,at any time,Construction Management,
Which of the following is not a part of contract document,Manning schedule,Price schedule,Work Schedule,Cost estimate,Construction Management,
Functional Organization was introduced b,F.W. Taylor,Henry Gantt,Newton,M.R. Walker,Construction Management,
Gantt chart is used for,Planning a project,Scheduling a project,monitoring a project,implementing project,Construction Management,
Critical path is,Always longest,Always shortest,May be long,May be short,Construction Management,
The first stage of a construction is,Initiation of proposal,Survey of site,preparation of tender,preparation of estimate,Construction Management,
The object of technical planning is,All of the given,Preparation of specification and estimates,Initiating the procurement action of resources,Taking remedial action for likely bottle neck in the excavation,Construction Management,
What do you mean by a site plan,All of the given,Detail breakdown of different construction activities,Detail space allocation for different group of activities,Detail breakdown of different types of labors,Construction Management,
The main function of construction management is,All of the given,Planning,Organizing,Directing,Construction Management,
A golden rule for the procurement of construction site is that,2/3 of the construction materials should be at work site and 1/3 under procurement,Half of the construction materials should be at work site and other half at procurement,3/4 of the construction materials should be at work site and 1/4 under procurement,Whole of the construction material should be at work,Construction Management,
The construction of residential building is treated as,light construction,heavy construction,industrial construction,none of the above,Construction Management,
The concept or idea for any construction work is the responsibility of,Owner,Engineer,Contractor,All of the above,Construction Management,
A construction team includes,All of the given,Owner,Contractor,Engineer,Construction Management,
Bar chart is used for,minor work,major work,emergency work,all kinds of work,Construction Management,
The pre-tender stage of construction requires,All of the given,Selection of site,Acquisition of land,Finalization of designs,Construction Management,
The probability of completion of any activity within specified time is,50%,100%,0%,49.90%,Construction Management,
The post tender stage of construction consists of,All of the given,Assessment of work,finalization of accounts,Assessment of expenditure,Construction Management,
"In which of the following organization structure, each specialist is supposed to give his functional advice to all other foreman and workers",functional organization,line organization,line and staff organization,Matrix organizarion,Construction Management,
The major principle of an organization is,All of the given,Span of management,Unity of command,Delegation of authority and responsibility,Construction Management,
Time and progress chart is known as,All of the given,Bar chart,Modified milestone chart,CPM,Construction Management,
The process of calculating the resources requirement of a project implementation is known as,Resource aggregation,Resource levelling,Scheduling,Resource smoothening,Construction Management,
The earliest method for planning project was,Bar chart,CPM,PERT,Milestone chart,Construction Management,
A milestone chart,Shows the events in chronological order but not logical order,Shows interdependence of various jobs,All of these,Depicts delay of job,Construction Management,
Jobs going ahead of schedule are conveniently shown in,Gantt Chart,Milestone chart,Pie chart,None of these,Construction Management,
A Gantt chart indicates,Comparison of actual progress with scheduled progress,Balance of work to be done,Progress cost of project,Efficiency of work,Construction Management,
"Various activities of a project, are shown on bar chart by",Horizontal lines,Vertical lines,Dots,Crosses,Construction Management,
The start or completion of a task is called,An activity,An event,A duration,Any of these,Construction Management,
An activity is,An element of work entailed in the project,The beginning or end of a specified job,The movement of heavy vehicles frome one place to other,The progress ,Construction Management,
TF-FF is,Interferring float,Duration,Critical activity,Independent Float,Construction Management,
In line organization,All of the given,Discipline is strong,Quick decision are taken,Responsibility of each individual is fixed,Construction Management,
Which of the following is primary process for procurement of goods and services from a competetive market?,Bidding,Payment,Deposit,Order placement,Construction Management,
The time after which direct cost doesn't reduce with increase in time is,Normal time,Crash time,Optimistic time,Standard time,Construction Management,
The direct cost of project with respect to normal time is,Minimum,Maximum,Zero,Infinite,Construction Management,
The reduction in project time normally results in,Increasing direct cost and decreasing indirect cost,Decreasing the direct cost and increasing indirect cost,Increasing both direct and Indirect cost,Decreasing both direct and indirect cost,Construction Management,
Types of organization used in construction industry is,Line organization,Functional organization,Matrix organization,Line and staff organization,Construction Management,
Amount to be deposited by contractor while submitting tender is,Earnest money,Fixed deposit,Caution deposit,Security deposit,Construction Management,
The amount of earnest money to be deposited while bidding a tender is_____ of estimated cost of project,2-3%,3-5%,5-10%,Any of these,Construction Management,
The amount of performance security to be deposited by a successful contractor is___ of the estimated cost,Both of given,5% for Nepali,10% for foreigner,None of these,Construction Management,
"In analysis of rate, profit for the contractor is generally taken as",10%,15%,20%,5%,Construction Management,
PERT requires,Triple time estimate,Single time estimate,Double time estimate,no time estimate,Construction Management,
Dummy activities are used to,Maintain the required network,Determine the critical path,Determine project duration,None of the given,Construction Management,
An imaginary line joining points of equal elevation on the surface of earth is called,contour line,contour gradient,contour surface,level line,Contouring,
A leminiscate curve between the tangents will be transitional throughout if the polar deflection angle of its apex is,Δ/6,Δ/4,Δ/2,5Δ/6,Curves,
The lead becomes softer as the numeral letter H on pencil,decreases ,increases,remains same,not applicable,Drawing,Softer leads with B and harder leads with H
Scale used for architectural and building drawing plans is,1 :100,1 :50,1 :200,1 :500,Drawing,
Free hand sketch is normally used for,concept,final ,discussion,none of above,Drawing,
Picture plane in a perspective projection is,transparent vertical plane,transparent inclined plane,opaque horizontal plane,opaque vertical plane,Drawing,
A working drawing shows,detailed dimension of an element,dimension shoown only for main parts,no cross-section,none of above,Drawing,
The 'MAP' is,a small scaled graphical projection on a horizontal plane,a enlarged scale projection on a vertical plane,projection of the feature on the earth's surface in a horizontal plane,projection of entire feature on vertical and horizontal plane,Drawing,
Site plan shows,location of building,face of building,section of building,details of building,Drawing,
"In which of the following projection, observer is at finite distance from the object?",Perspective ,isometric,oblique,orthographic,Drawing,
The smooth curves in a fair drawing are drawn with the help of,French Curve,Compass,Protractor,scale,Drawing,
"In orthographic projections, the projectors to the plane of projection are",perpendicular,parallel,inclined,none of the above,Drawing,
Select the correct statement,The smooth face of the drawing sheet is the proper side for drawing work,The rough surface is used for drawing work,There is no proper side for drawing sheet,Roughness and smoothness do not affect the drawing work,Drawing,
The isometric length of the cube is,less than the actual length,more than the actual length,equal to actual length,none of the above,Drawing,
A building drawing consists of,All of the above,Site plans and floor plans,elevations and sections,foundation details,Drawing,
Which is not true,Arrow head should be thick and not fillled in,dimension lines should not cross each other,lettering is done in capital letters in general,construction lines are continuous thin lines,Drawing,
Hidden lines are drawn as,dashed narrow lines,dashed wide lines,long dashes dotted wide lines,long dashed double dotted wide line,Engineering Drawing,
In orthographic projection,All of the above,Plans are drawn,Elevations are drawn,Side elevations are drawn,Engineering Drawing,
Orthographic view of objects can be represented by,Both angle projection,first angle projection,Third angle projection,none of the given,Engineering Drawing,
"In which of the following, the projectors are not perpendicular to the plane of projection",perspective ,orthographic,axonometric,graphic,Engineering Drawing,
Pictorial sketches are,All of the above,Isometric,Oblique,Perspective,Engineering Drawing,
French curves are used to draw,Irregular curve lines,Regular curve lines,long curve lines,free hand lines,Engineering Drawing,
Horizontal lines are drawn,Both,left to right,right to left,none of the given,Engineering Drawing,
Topographic map are used to represent,All of the above,natural detail,artificial detail,construction detail,Engineering Drawing,
"In isometric projection, square faces are seen as",Rhombus,Squares,Rectangles,none of the given,Engineering Drawing,
Net present value is,difference between cash inflow and cash outflow,cash inflow only,cash outflow only,any one of the above,Engineering Economics,
"If a is the base amount of expenditure, b is the increase in operation cost each year over a period of n years, the total cost of maintenance is",a+(n-1)b,a+(n+1)b,ax(n-1)b,ax(n+1)b,Engineering Economics,
Ratio analysis of construction firm is used for analysis by,financial analysis,share holders,banks of firm,firm's management,Engineering Economics,
"If P is the principal amount, I is the interest rate per year, N is the number of periods in n years, the interest amount is",P(1+i)^n-P,P(1+i)^n+P,P(1-i)^n-P,P(1-i)^n+P,Engineering Economics,
The time value of money is considered in the,All of above,Present Worth Method,Future Worth Method,Internal Rate of Return Method,Engineering Economics,
Sensitivity Analysis is,examination of range of values for some parameters to determine their effect on a particular decision,the ratio of benefits to cost using either present worth or annual cash flow calculations,condition under which alternatives are equivalent,to change one to many estimates and see what the result is,Engineering Economics,
The difference between discounted benefit and cost is called,NPV,PV,benefit,none of these,Engineering Economics,
Inflation is a normal phenomenon in which,nominal price of object is raised,nominal price of object is decreased ,nominal price of object is not changed,none of these,Engineering Economics,
Sensitivity analysis can be used to examine a project's viability when the following factor is changed,All of the given,annual expenses,interest rate,capital investment,Engineering Economics,
Sensitivity analysis is the study of,Change in output due to change in input,comparison of profit and loss,economics of cost and benefit of project,comparison of asset and liabilities,Engineering Economics,
The Engineering council consists of the following members,18,7,8,9,Engineering Professional Practice,
Professional code of professional engineering ethics is,both of above,upholding and advancing engineering profession,maintain high standard of ethical conduct,none of above,Engineering Professional Practice,
Professional code of conduct issued by Nepal Engineering Council has,8 articles,5 articles,7 articles,10 articles,Engineering Professional Practice,
Which is link ministry of Nepal Engineering Council,Ministry of Physical planning and works,Ministry of general administration,ministry of energy,ministry of irrigation,Engineering Professional Practice,
The minimum qualification required for general engineer is,Bachelor in engineering,diploma in engineering,master in engineerin,any one of above,Engineering Professional Practice,
Which of the following category on Engineer is not mentioned in Engineering Council rule,Chartered Engineer,General Engineer,Professional Engineer,Non Nepali Resident Engineer,Engineering Professional Practice,
Engineers shall build their professional reputation on the .......... of their service and shall not compete unfairly with others,basis,publicity,merit,regulation,Engineering Professional Practice,
